{
  "format": "palo-ai-system-record",
  "schemaVersion": "1.0.0",
  "systemId": "ai-system-support-analytics",
  "recordVersion": "1.0.0",
  "tenantId": "tenant-a",
  "name": "Support analytics agent",
  "useCase": "Summarize operational order trends without row-level egress.",
  "status": "pilot",
  "riskClass": "limited",
  "jurisdictions": ["EU"],
  "owners": ["ai-owner@example.org"],
  "relationships": { "models": ["deterministic-summary-v1"], "agents": ["agent-support-analytics"], "tools": ["actian-db-query"], "dataSubjects": ["actian:asset/customer-orders"], "providers": ["local-rules"] },
  "deployedVersion": "2026.08.25-pilot",
  "policyBundleDigest": "sha256:cccccccccccccccccccccccccccccccccccccccccccccccccccccccccccccccc",
  "evidenceRefs": ["evidence-ref-11111111-1111-4111-8111-111111111111"],
  "updatedAt": "2026-08-25T08:05:00Z"
}
